Section,Name,Item,Compliance,Description,L1,L2,L3,CWE,NIST
V10,Malicious,10.3.3,,"Verify that the application has protection from sub-domain takeovers if the application relies upon DNS entries or DNS sub-domains, such as expired domain names, out of date DNS pointers or CNAMEs, expired projects at public source code repos, or transient cloud APIs, serverless functions, or storage buckets (autogen-bucket-id.cloud.example.com) or similar. Protections can include ensuring that DNS names used by applications are regularly checked for expiry or change.",X,X,X,350,
V11,BusLogic,11.1.1,,Verify the application will only process business logic flows for the same user in sequential step order and without skipping steps.,X,X,X,841,
V11,BusLogic,11.1.2,,"Verify the application will only process business logic flows with all steps being processed in realistic human time, i.e. transactions are not submitted too quickly.",X,X,X,779,
V11,BusLogic,11.1.3,,Verify the application has appropriate limits for specific business actions or transactions which are correctly enforced on a per user basis.,X,X,X,770,
V11,BusLogic,11.1.4,,"Verify the application has sufficient anti-automation controls to detect and protect against data exfiltration, excessive business logic requests, excessive file uploads or denial of service attacks.",X,X,X,770,
V11,BusLogic,11.1.5,,"Verify the application has business logic limits or validation to protect against likely business risks or threats, identified using threat modelling or similar methodologies.",X,X,X,841,
V11,BusLogic,11.1.6,,"Verify the application does not suffer from ""time of check to time of use"" (TOCTOU) issues or other race conditions for sensitive operations.",,X,X,367,
V11,BusLogic,11.1.7,,"Verify the application monitors for unusual events or activity from a business logic perspective. For example, attempts to perform actions out of order or actions which a normal user would never attempt. ([C9](https://www.owasp.org/index.php/OWASP_Proactive_Controls#tab=Formal_Numbering))",,X,X,754,
V11,BusLogic,11.1.8,,Verify the application has configurable alerting when automated attacks or unusual activity is detected.,,X,X,390,
V12,Files,12.1.1,,Verify that the application will not accept large files that could fill up storage or cause a denial of service attack.,X,X,X,400,
V12,Files,12.1.2,,"Verify that compressed files are checked for ""zip bombs"" - small input files that will decompress into huge files thus exhausting file storage limits.",,X,X,409,
V12,Files,12.1.3,,"Verify that a file size quota and maximum number of files per user is enforced to ensure that a single user cannot fill up the storage with too many files, or excessively large files.",,X,X,770,
V12,Files,12.2.1,,Verify that files obtained from untrusted sources are validated to be of expected type based on the file's content.,,X,X,434,
V12,Files,12.3.1,,Verify that user-submitted filename metadata is not used directly with system or framework file and URL API to protect against path traversal.,X,X,X,22,
V12,Files,12.3.2,,"Verify that user-submitted filename metadata is validated or ignored to prevent the disclosure, creation, updating or removal of local files (LFI).",X,X,X,73,
V12,Files,12.3.3,,"Verify that user-submitted filename metadata is validated or ignored to prevent the disclosure or execution of remote files (RFI), which may also lead to SSRF.",X,X,X,98,
V12,Files,12.3.4,,"Verify that the application protects against reflective file download (RFD) by validating or ignoring user-submitted filenames in a JSON, JSONP, or URL parameter, the response Content-Type header should be set to text/plain, and the Content-Disposition header should have a fixed filename.",X,X,X,641,
V12,Files,12.3.5,,"Verify that untrusted file metadata is not used directly with system API or libraries, to protect against OS command injection.",X,X,X,78,
V12,Files,12.3.6,,"Verify that the application does not include and execute functionality from untrusted sources, such as unverified content distribution networks, JavaScript libraries, node npm libraries, or server-side DLLs.",,X,X,829,
V12,Files,12.4.1,,"Verify that files obtained from untrusted sources are stored outside the web root, with limited permissions, preferably with strong validation.",X,X,X,922,
V12,Files,12.4.2,,Verify that files obtained from untrusted sources are scanned by antivirus scanners to prevent upload of known malicious content.,X,X,X,509,
V12,Files,12.5.1,,"Verify that the web tier is configured to serve only files with specific file extensions to prevent unintentional information and source code leakage. For example, backup files (e.g. .bak), temporary working files (e.g. .swp), compressed files (.zip, .tar.gz, etc) and other extensions commonly used by editors should be blocked unless required.",X,X,X,552,
V12,Files,12.5.2,,Verify that direct requests to uploaded files will never be executed as HTML/JavaScript content.,X,X,X,434,
V12,Files,12.6.1,,Verify that the web or application server is configured with a whitelist of resources or systems to which the server can send requests or load data/files from.,X,X,X,918,
V13,API,13.1.1,,Verify that all application components use the same encodings and parsers to avoid parsing attacks that exploit different URI or file parsing behavior that could be used in SSRF and RFI attacks.,X,X,X,116,
V13,API,13.1.2,,Verify that access to administration and management functions is limited to authorized administrators.,X,X,X,419,
V13,API,13.1.3,,"Verify API URLs do not expose sensitive information, such as the API key, session tokens etc.",X,X,X,598,
V13,API,13.1.4,,"Verify that authorization decisions are made at both the URI, enforced by programmatic or declarative security at the controller or router, and at the resource level, enforced by model-based permissions.",,X,X,285,
V13,API,13.1.5,,Verify that requests containing unexpected or missing content types are rejected with appropriate headers (HTTP response status 406 Unacceptable or 415 Unsupported Media Type).,,X,X,434,
V13,API,13.2.1,,"Verify that enabled RESTful HTTP methods are a valid choice for the user or action, such as preventing normal users using DELETE or PUT on protected API or resources.",X,X,X,650,
V13,API,13.2.2,,Verify that JSON schema validation is in place and verified before accepting input.,X,X,X,20,
V13,API,13.2.3,,"Verify that RESTful web services that utilize cookies are protected from Cross-Site Request Forgery via the use of at least one or more of the following: triple or double submit cookie pattern (see [references](https://www.owasp.org/index.php/Cross-Site_Request_Forgery_(CSRF)_Prevention_Cheat_Sheet)), CSRF nonces, or ORIGIN request header checks.",X,X,X,352,
V13,API,13.2.4,,"Verify that REST services have anti-automation controls to protect against excessive calls, especially if the API is unauthenticated.",,X,X,779,
V13,API,13.2.5,,"Verify that REST services explicitly check the incoming Content-Type to be the expected one, such as application/xml or application/JSON.",,X,X,436,
V13,API,13.2.6,,Verify that the message headers and payload are trustworthy and not modified in transit. Requiring strong encryption for transport (TLS only) may be sufficient in many cases as it provides both confidentiality and integrity protection. Per-message digital signatures can provide additional assurance on top of the transport protections for high-security applications but bring with them additional complexity and risks to weigh against the benefits.,,X,X,345,
V13,API,13.3.1,,"Verify that XSD schema validation takes place to ensure a properly formed XML document, followed by validation of each input field before any processing of that data takes place.",X,X,X,20,
V13,API,13.3.2,,Verify that the message payload is signed using WS-Security to ensure reliable transport between client and service.,,X,X,345,
V13,API,13.4.1,,"Verify that query whitelisting or a combination of depth limiting and amount limiting should be used to prevent GraphQL or data layer expression denial of service (DoS) as a result of expensive, nested queries. For more advanced scenarios, query cost analysis should be used.",,X,X,770,
V13,API,13.4.2,,Verify that GraphQL or other data layer authorization logic should be implemented at the business logic layer instead of the GraphQL layer.,,X,X,285,
V14,Config,14.1.1,,"Verify that the application build and deployment processes are performed in a secure and repeatable way, such as CI / CD automation, automated configuration management, and automated deployment scripts.",,X,X,,
V14,Config,14.1.2,,"Verify that compiler flags are configured to enable all available buffer overflow protections and warnings, including stack randomization, data execution prevention, and to break the build if an unsafe pointer, memory, format string, integer, or string operations are found.",,X,X,120,
V14,Config,14.1.3,,Verify that server configuration is hardened as per the recommendations of the application server and frameworks in use.,,X,X,16,
V14,Config,14.1.4,,"Verify that the application, configuration, and all dependencies can be re-deployed using automated deployment scripts, built from a documented and tested runbook in a reasonable time, or restored from backups in a timely fashion.",,X,X,,
V14,Config,14.1.5,,Verify that authorized administrators can verify the integrity of all security-relevant configurations to detect tampering.,,,X,,
V14,Config,14.2.1,,"Verify that all components are up to date, preferably using a dependency checker during build or compile time. ([C2](https://www.owasp.org/index.php/OWASP_Proactive_Controls#tab=Formal_Numbering))",X,X,X,1026,
V14,Config,14.2.2,,"Verify that all unneeded features, documentation, samples, configurations are removed, such as sample applications, platform documentation, and default or example users.",X,X,X,1002,
V14,Config,14.2.3,,"Verify that if application assets, such as JavaScript libraries, CSS stylesheets or web fonts, are hosted externally on a content delivery network (CDN) or external provider, Subresource Integrity (SRI) is used to validate the integrity of the asset.",X,X,X,714,
V14,Config,14.2.4,,"Verify that third party components come from pre-defined, trusted and continually maintained repositories. ([C2](https://www.owasp.org/index.php/OWASP_Proactive_Controls#tab=Formal_Numbering))",,X,X,829,
V14,Config,14.2.5,,Verify that an inventory catalog is maintained of all third party libraries in use. ([C2](https://www.owasp.org/index.php/OWASP_Proactive_Controls#tab=Formal_Numbering)),,X,X,,
V14,Config,14.2.6,,Verify that the attack surface is reduced by sandboxing or encapsulating third party libraries to expose only the required behaviour into the application. ([C2](https://www.owasp.org/index.php/OWASP_Proactive_Controls#tab=Formal_Numbering)),,X,X,265,
V14,Config,14.3.1,,"Verify that web or application server and framework error messages are configured to deliver user actionable, customized responses to eliminate any unintended security disclosures.",X,X,X,209,
V14,Config,14.3.2,,"Verify that web or application server and application framework debug modes are disabled in production to eliminate debug features, developer consoles, and unintended security disclosures.",X,X,X,497,
V14,Config,14.3.3,,Verify that the HTTP headers or any part of the HTTP response do not expose detailed version information of system components.,X,X,X,200,
V14,Config,14.4.1,,"Verify that every HTTP response contains a content type header specifying a safe character set (e.g., UTF-8, ISO 8859-1).",X,X,X,173,
V14,Config,14.4.2,,"Verify that all API responses contain Content-Disposition: attachment; filename=""api.json"" (or other appropriate filename for the content type).",X,X,X,116,
V14,Config,14.4.3,,"Verify that a content security policy (CSPv2) is in place that helps mitigate impact for XSS attacks like HTML, DOM, JSON, and JavaScript injection vulnerabilities.",X,X,X,1021,
V14,Config,14.4.4,,Verify that all responses contain X-Content-Type-Options: nosniff.,X,X,X,116,
V14,Config,14.4.5,,"Verify that HTTP Strict Transport Security headers are included on all responses and for all subdomains, such as Strict-Transport-Security: max-age=15724800; includeSubdomains.",X,X,X,523,
V14,Config,14.4.6,,"Verify that a suitable ""Referrer-Policy"" header is included, such as ""no-referrer"" or ""same-origin"".",X,X,X,116,
V14,Config,14.4.7,,Verify that a suitable X-Frame-Options or Content-Security-Policy: frame-ancestors header is in use for sites where content should not be embedded in a third-party site.,X,X,X,346,
V14,Config,14.5.1,,"Verify that the application server only accepts the HTTP methods in use by the application or API, including pre-flight OPTIONS.",X,X,X,749,
V14,Config,14.5.2,,"Verify that the supplied Origin header is not used for authentication or access control decisions, as the Origin header can easily be changed by an attacker.",X,X,X,346,
V14,Config,14.5.3,,"Verify that the cross-domain resource sharing (CORS) Access-Control-Allow-Origin header uses a strict white-list of trusted domains to match against and does not support the ""null"" origin.",X,X,X,346,
V14,Config,14.5.4,,"Verify that HTTP headers added by a trusted proxy or SSO devices, such as a bearer token, are authenticated by the application.",,X,X,306,
