Section,Name,Item,Compliance,Description,L1,L2,L3,CWE,NIST
V1,Architecture,1.1.1,N/A,Verify the use of a secure software development lifecycle that addresses security in all stages of development. ([C1](https://www.owasp.org/index.php/OWASP_Proactive_Controls#tab=Formal_Numbering)),,X,X,,
V1,Architecture,1.1.2,N/A,"Verify the use of threat modeling for every design change or sprint planning to identify threats, plan for countermeasures, facilitate appropriate risk responses, and guide security testing.",,X,X,1053,
V1,Architecture,1.1.3,N/A,"Verify that all user stories and features contain functional security constraints, such as ""As a user, I should be able to view and edit my profile. I should not be able to view or edit anyone else's profile""",,X,X,1110,
V1,Architecture,1.1.4,N/A,"Verify documentation and justification of all the application's trust boundaries, components, and significant data flows.",,X,X,1059,
V1,Architecture,1.1.5,N/A,Verify definition and security analysis of the application's high-level architecture and all connected remote services. ([C1](https://www.owasp.org/index.php/OWASP_Proactive_Controls#tab=Formal_Numbering)),,X,X,1059,
V1,Architecture,1.1.6,N/A,"Verify implementation of centralized, simple (economy of design), vetted, secure, and reusable security controls to avoid duplicate, missing, ineffective, or insecure controls. ([C10](https://www.owasp.org/index.php/OWASP_Proactive_Controls#tab=Formal_Numbering))",,X,X,637,
V1,Architecture,1.1.7,N/A,"Verify availability of a secure coding checklist, security requirements, guideline, or policy to all developers and testers.",,X,X,637,
V1,Architecture,1.10.1,Yes,"Verify that a source code control system is in use, with procedures to ensure that check-ins are accompanied by issues or change tickets. The source code control system should have access control and identifiable users to allow traceability of any changes.",,X,X,284,
V1,Architecture,1.11.1,N/A,Verify the definition and documentation of all application components in terms of the business or security functions they provide.,,X,X,1059,
V1,Architecture,1.11.2,N/A,"Verify that all high-value business logic flows, including authentication, session management and access control, do not share unsynchronized state.",,X,X,362,
V1,Architecture,1.11.3,N/A,"Verify that all high-value business logic flows, including authentication, session management and access control are thread safe and resistant to time-of-check and time-of-use race conditions.",,,X,367,
V1,Architecture,1.12.1,N/A,Verify that user-uploaded files are stored outside of the web root.,,X,X,552,
V1,Architecture,1.12.2,N/A,"Verify that user-uploaded files - if required to be displayed or downloaded from the application - are served by either octet stream downloads, or from an unrelated domain, such as a cloud file storage bucket. Implement a suitable content security policy to reduce the risk from XSS vectors or other attacks from the uploaded file.",,X,X,646,
V1,Architecture,1.14.1,N/A,"Verify the segregation of components of differing trust levels through well-defined security controls, firewall rules, API gateways, reverse proxies, cloud-based security groups, or similar mechanisms.",,X,X,923,
V1,Architecture,1.14.2,N/A,"Verify that if deploying binaries to untrusted devices makes use of binary signatures, trusted connections, and verified endpoints.",,X,X,494,
V1,Architecture,1.14.3,N/A,Verify that the build pipeline warns of out-of-date or insecure components and takes appropriate actions.,,X,X,1104,
V1,Architecture,1.14.4,N/A,"Verify that the build pipeline contains a build step to automatically build and verify the secure deployment of the application, particularly if the application infrastructure is software defined, such as cloud environment build scripts.",,X,X,,
V1,Architecture,1.14.5,N/A,"Verify that application deployments adequately sandbox, containerize and/or isolate at the network level to delay and deter attackers from attacking other applications, especially when they are performing sensitive or dangerous actions such as deserialization. ([C5](https://www.owasp.org/index.php/OWASP_Proactive_Controls#tab=Formal_Numbering))",,X,X,265,
V1,Architecture,1.14.6,N/A,"Verify the application does not use unsupported, insecure, or deprecated client-side technologies such as NSAPI plugins, Flash, Shockwave, ActiveX, Silverlight, NACL, or client-side Java applets.",,X,X,477,
V1,Architecture,1.2.1,N/A,"Verify the use of unique or special low-privilege operating system accounts for all application components, services, and servers. ([C3](https://www.owasp.org/index.php/OWASP_Proactive_Controls#tab=Formal_Numbering))",,X,X,250,
V1,Architecture,1.2.2,N/A,"Verify that communications between application components, including APIs, middleware and data layers, are authenticated. Components should have the least necessary privileges needed. ([C3](https://www.owasp.org/index.php/OWASP_Proactive_Controls#tab=Formal_Numbering))",,X,X,306,
V1,Architecture,1.2.3,N/A,"Verify that the application uses a single vetted authentication mechanism that is known to be secure, can be extended to include strong authentication, and has sufficient logging and monitoring to detect account abuse or breaches.",,X,X,306,
V1,Architecture,1.2.4,N/A,"Verify that all authentication pathways and identity management APIs implement consistent authentication security control strength, such that there are no weaker alternatives per the risk of the application.",,X,X,306,
V1,Architecture,1.4.1,N/A,"Verify that trusted enforcement points such as at access control gateways, servers, and serverless functions enforce access controls. Never enforce access controls on the client.",,X,X,602,
V1,Architecture,1.4.2,N/A,Verify that the chosen access control solution is flexible enough to meet the application's needs.,,X,X,284,
V1,Architecture,1.4.3,N/A,"Verify enforcement of the principle of least privilege in functions, data files, URLs, controllers, services, and other resources. This implies protection against spoofing and elevation of privilege.",,X,X,272,
V1,Architecture,1.4.4,N/A,Verify the application uses a single and well-vetted access control mechanism for accessing protected data and resources. All requests must pass through this single mechanism to avoid copy and paste or insecure alternative paths. ([C7](https://www.owasp.org/index.php/OWASP_Proactive_Controls#tab=Formal_Numbering)),,X,X,284,
V1,Architecture,1.4.5,N/A,Verify that attribute or feature-based access control is used whereby the code checks the user's authorization for a feature/data item rather than just their role. Permissions should still be allocated using roles. ([C7](https://www.owasp.org/index.php/OWASP_Proactive_Controls#tab=Formal_Numbering)),,X,X,275,
V1,Architecture,1.5.1,N/A,"Verify that input and output requirements clearly define how to handle and process data based on type, content, and applicable laws, regulations, and other policy compliance.",,X,X,1029,
V1,Architecture,1.5.2,N/A,"Verify that serialization is not used when communicating with untrusted clients. If this is not possible, ensure that adequate integrity controls (and possibly encryption if sensitive data is sent) are enforced to prevent deserialization attacks including object injection.",,X,X,502,
V1,Architecture,1.5.3,N/A,Verify that input validation is enforced on a trusted service layer. ([C5](https://www.owasp.org/index.php/OWASP_Proactive_Controls#tab=Formal_Numbering)),,X,X,602,
V1,Architecture,1.5.4,N/A,Verify that output encoding occurs close to or by the interpreter for which it is intended. ([C4](https://www.owasp.org/index.php/OWASP_Proactive_Controls#tab=Formal_Numbering)),,X,X,116,
V1,Architecture,1.6.1,N/A,Verify that there is an explicit policy for management of cryptographic keys and that a cryptographic key lifecycle follows a key management standard such as NIST SP 800-57.,,X,X,320,
V1,Architecture,1.6.2,N/A,Verify that consumers of cryptographic services protect key material and other secrets by using key vaults or API based alternatives.,,X,X,320,
V1,Architecture,1.6.3,N/A,Verify that all keys and passwords are replaceable and are part of a well-defined process to re-encrypt sensitive data.,,X,X,320,
V1,Architecture,1.6.4,N/A,"Verify that symmetric keys, passwords, or API secrets generated by or shared with clients are used only in protecting low risk secrets, such as encrypting local storage, or temporary ephemeral uses such as parameter obfuscation. Sharing secrets with clients is clear-text equivalent and architecturally should be treated as such.",,X,X,320,
V1,Architecture,1.7.1,N/A,Verify that a common logging format and approach is used across the system.  ([C9](https://www.owasp.org/index.php/OWASP_Proactive_Controls#tab=Formal_Numbering)),,X,X,1009,
V1,Architecture,1.7.2,N/A,"Verify that logs are securely transmitted to a preferably remote system for analysis, detection, alerting, and escalation. ([C9](https://www.owasp.org/index.php/OWASP_Proactive_Controls#tab=Formal_Numbering))",,X,X,,
V1,Architecture,1.8.1,N/A,Verify that all sensitive data is identified and classified into protection levels.,,X,X,,
V1,Architecture,1.8.2,N/A,"Verify that all protection levels have an associated set of protection requirements, such as encryption requirements, integrity requirements, retention, privacy and other confidentiality requirements, and that these are applied in the architecture.",,X,X,,
V1,Architecture,1.9.1,N/A,"Verify the application encrypts communications between components, particularly when these components are in different containers, systems, sites, or cloud providers. ([C3](https://www.owasp.org/index.php/OWASP_Proactive_Controls#tab=Formal_Numbering))",,X,X,319,
V1,Architecture,1.9.2,N/A,"Verify that application components verify the authenticity of each side in a communication link to prevent person-in-the-middle attacks. For example, application components should validate TLS certificates and chains.",,X,X,295,
V2,Authentication,2.1.1,Yes,Verify that user set passwords are at least 12 characters in length. ([C6](https://www.owasp.org/index.php/OWASP_Proactive_Controls#tab=Formal_Numbering)),X,X,X,521,5.1.1.2
V2,Authentication,2.1.10,Yes,Verify that there are no periodic credential rotation or password history requirements.,X,X,X,263,5.1.1.2
V2,Authentication,2.1.11,Yes,"Verify that ""paste"" functionality, browser password helpers, and external password managers are permitted.",X,X,X,521,5.1.1.2
V2,Authentication,2.1.12,No,"Verify that the user can choose to either temporarily view the entire masked password, or temporarily view the last typed character of the password on platforms that do not have this as native functionality.",X,X,X,521,5.1.1.2
V2,Authentication,2.1.2,Yes,Verify that passwords 64 characters or longer are permitted. ([C6](https://www.owasp.org/index.php/OWASP_Proactive_Controls#tab=Formal_Numbering)),X,X,X,521,5.1.1.2
V2,Authentication,2.1.3,Yes,Verify that passwords can contain spaces and truncation is not performed. Consecutive multiple spaces MAY optionally be coalesced. ([C6](https://www.owasp.org/index.php/OWASP_Proactive_Controls#tab=Formal_Numbering)),X,X,X,521,5.1.1.2
V2,Authentication,2.1.4,No,"Verify that Unicode characters are permitted in passwords. A single Unicode code point is considered a character, so 12 emoji or 64 kanji characters should be valid and permitted.",X,X,X,521,5.1.1.2
V2,Authentication,2.1.5,Yes,Verify users can change their password.,X,X,X,620,5.1.1.2
V2,Authentication,2.1.6,Yes,Verify that password change functionality requires the user's current and new password.,X,X,X,620,5.1.1.2
V2,Authentication,2.1.7,Yes,"Verify that passwords submitted during account registration, login, and password change are checked against a set of breached passwords either locally (such as the top 1,000 or 10,000 most common passwords which match the system's password policy) or using an external API. If using an API a zero knowledge proof or other mechanism should be used to ensure that the plain text password is not sent or used in verifying the breach status of the password. If the password is breached, the application must require the user to set a new non-breached password. ([C6](https://www.owasp.org/index.php/OWASP_Proactive_Controls#tab=Formal_Numbering))",X,X,X,521,5.1.1.2
V2,Authentication,2.1.8,,Verify that a password strength meter is provided to help users set a stronger password.,X,X,X,521,5.1.1.2
V2,Authentication,2.1.9,Yes,Verify that there are no password composition rules limiting the type of characters permitted. There should be no requirement for upper or lower case or numbers or special characters. ([C6](https://www.owasp.org/index.php/OWASP_Proactive_Controls#tab=Formal_Numbering)),X,X,X,521,5.1.1.2
V2,Authentication,2.10.1,,"Verify that integration secrets do not rely on unchanging passwords, such as API keys or shared privileged accounts.",,OS assisted,HSM,287,5.1.1.1
V2,Authentication,2.10.2,,"Verify that if passwords are required, the credentials are not a default account.",,OS assisted,HSM,255,5.1.1.1
V2,Authentication,2.10.3,,"Verify that passwords are stored with sufficient protection to prevent offline recovery attacks, including local system access.",,OS assisted,HSM,522,5.1.1.1
V2,Authentication,2.10.4,,"Verify passwords, integrations with databases and third-party systems, seeds and internal secrets, and API keys are managed securely and not included in the source code or stored within source code repositories. Such storage SHOULD resist offline attacks. The use of a secure software key store (L1), hardware trusted platform module (TPM), or a hardware security module (L3) is recommended for password storage.",,OS assisted,HSM,798,
V2,Authentication,2.2.1,,"Verify that anti-automation controls are effective at mitigating breached credential testing, brute force, and account lockout attacks. Such controls include blocking the most common breached passwords, soft lockouts, rate limiting, CAPTCHA, ever increasing delays between attempts, IP address restrictions, or risk-based restrictions such as location, first login on a device, recent attempts to unlock the account, or similar. Verify that no more than 100 failed attempts per hour is possible on a single account.",X,X,X,307,5.2.2 / 5.1.1.2 / 5.1.4.2 / 5.1.5.2
V2,Authentication,2.2.2,,"Verify that the use of weak authenticators (such as SMS and email) is limited to secondary verification and transaction approval and not as a replacement for more secure authentication methods. Verify that stronger methods are offered before weak methods, users are aware of the risks, or that proper measures are in place to limit the risks of account compromise.",X,X,X,304,5.2.10
V2,Authentication,2.2.3,,"Verify that secure notifications are sent to users after updates to authentication details, such as credential resets, email or address changes, logging in from unknown or risky locations. The use of push notifications - rather than SMS or email - is preferred, but in the absence of push notifications, SMS or email is acceptable as long as no sensitive information is disclosed in the notification.",X,X,X,620,
V2,Authentication,2.2.4,,"Verify impersonation resistance against phishing, such as the use of multi-factor authentication, cryptographic devices with intent (such as connected keys with a push to authenticate), or at higher AAL levels, client-side certificates.",,,X,308,5.2.5
V2,Authentication,2.2.5,,"Verify that where a credential service provider (CSP) and the application verifying authentication are separated, mutually authenticated TLS is in place between the two endpoints.",,,X,319,5.2.6
V2,Authentication,2.2.6,,"Verify replay resistance through the mandated use of OTP devices, cryptographic authenticators, or lookup codes.",,,X,308,5.2.8
V2,Authentication,2.2.7,,Verify intent to authenticate by requiring the entry of an OTP token or user-initiated action such as a button press on a FIDO hardware key.,,,X,308,5.2.9
V2,Authentication,2.3.1,,"Verify system generated initial passwords or activation codes SHOULD be securely randomly generated, SHOULD be at least 6 characters long, and MAY contain letters and numbers, and expire after a short period of time. These initial secrets must not be permitted to become the long term password.",X,X,X,330,5.1.1.2 / A.3
V2,Authentication,2.3.2,,"Verify that enrollment and use of subscriber-provided authentication devices are supported, such as a U2F or FIDO tokens.",,X,X,308,6.1.3
V2,Authentication,2.3.3,,Verify that renewal instructions are sent with sufficient time to renew time bound authenticators.,,X,X,287,6.1.4
V2,Authentication,2.4.1,,"Verify that passwords are stored in a form that is resistant to offline attacks. Passwords SHALL be salted and hashed using an approved one-way key derivation or password hashing function. Key derivation and password hashing functions take a password, a salt, and a cost factor as inputs when generating a password hash. ([C6](https://www.owasp.org/index.php/OWASP_Proactive_Controls#tab=Formal_Numbering))",,X,X,916,5.1.1.2
V2,Authentication,2.4.2,,"Verify that the salt is at least 32 bits in length and be chosen arbitrarily to minimize salt value collisions among stored hashes. For each credential, a unique salt value and the resulting hash SHALL be stored. ([C6](https://www.owasp.org/index.php/OWASP_Proactive_Controls#tab=Formal_Numbering))",,X,X,916,5.1.1.2
V2,Authentication,2.4.3,,"Verify that if PBKDF2 is used, the iteration count SHOULD be as large as verification server performance will allow, typically at least 100,000 iterations. ([C6](https://www.owasp.org/index.php/OWASP_Proactive_Controls#tab=Formal_Numbering))",,X,X,916,5.1.1.2
V2,Authentication,2.4.4,,"Verify that if bcrypt is used, the work factor SHOULD be as large as verification server performance will allow, typically at least 13. ([C6](https://www.owasp.org/index.php/OWASP_Proactive_Controls#tab=Formal_Numbering))",,X,X,916,5.1.1.2
V2,Authentication,2.4.5,,"Verify that an additional iteration of a key derivation function is performed, using a salt value that is secret and known only to the verifier. Generate the salt value using an approved random bit generator [SP 800-90Ar1] and provide at least the minimum security strength specified in the latest revision of SP 800-131A. The secret salt value SHALL be stored separately from the hashed passwords (e.g., in a specialized device like a hardware security module).",,X,X,916,5.1.1.2
V2,Authentication,2.5.1,,Verify that a system generated initial activation or recovery secret is not sent in clear text to the user. ([C6](https://www.owasp.org/index.php/OWASP_Proactive_Controls#tab=Formal_Numbering)),X,X,X,640,5.1.1.2
V2,Authentication,2.5.2,,"Verify password hints or knowledge-based authentication (so-called ""secret questions"") are not present.",X,X,X,640,5.1.1.2
V2,Authentication,2.5.3,,Verify password credential recovery does not reveal the current password in any way. ([C6](https://www.owasp.org/index.php/OWASP_Proactive_Controls#tab=Formal_Numbering)),X,X,X,640,5.1.1.2
V2,Authentication,2.5.4,,"Verify shared or default accounts are not present (e.g. ""root"", ""admin"", or ""sa"").",X,X,X,16,5.1.1.2 / A.3
V2,Authentication,2.5.5,,"Verify that if an authentication factor is changed or replaced, that the user is notified of this event.",X,X,X,304,6.1.2.3
V2,Authentication,2.5.6,,"Verify forgotten password, and other recovery paths use a secure recovery mechanism, such as TOTP or other soft token, mobile push, or another offline recovery mechanism. ([C6](https://www.owasp.org/index.php/OWASP_Proactive_Controls#tab=Formal_Numbering))",X,X,X,640,5.1.1.2
V2,Authentication,2.5.7,,"Verify that if OTP or multi-factor authentication factors are lost, that evidence of identity proofing is performed at the same level as during enrollment.",,X,X,308,6.1.2.3
V2,Authentication,2.6.1,,Verify that lookup secrets can be used only once.,,X,X,308,5.1.2.2
V2,Authentication,2.6.2,,"Verify that lookup secrets have sufficient randomness (112 bits of entropy), or if less than 112 bits of entropy, salted with a unique and random 32-bit salt and hashed with an approved one-way hash.",,X,X,330,5.1.2.2
V2,Authentication,2.6.3,,"Verify that lookup secrets are resistant to offline attacks, such as predictable values.",,X,X,310,5.1.2.2
V2,Authentication,2.7.1,,"Verify that clear text out of band (NIST ""restricted"") authenticators, such as SMS or PSTN, are not offered by default, and stronger alternatives such as push notifications are offered first.",X,X,X,287,5.1.3.2
V2,Authentication,2.7.2,,"Verify that the out of band verifier expires out of band authentication requests, codes, or tokens after 10 minutes.",X,X,X,287,5.1.3.2
V2,Authentication,2.7.3,,"Verify that the out of band verifier authentication requests, codes, or tokens are only usable once, and only for the original authentication request.",X,X,X,287,5.1.3.2
V2,Authentication,2.7.4,,Verify that the out of band authenticator and verifier communicates over a secure independent channel.,X,X,X,523,5.1.3.2
V2,Authentication,2.7.5,,Verify that the out of band verifier retains only a hashed version of the authentication code.,,X,X,256,5.1.3.2
V2,Authentication,2.7.6,,"Verify that the initial authentication code is generated by a secure random number generator, containing at least 20 bits of entropy (typically a six digital random number is sufficient).",,X,X,310,5.1.3.2
V2,Authentication,2.8.1,,Verify that time-based OTPs have a defined lifetime before expiring.,X,X,X,613,5.1.4.2 / 5.1.5.2
V2,Authentication,2.8.2,,"Verify that symmetric keys used to verify submitted OTPs are highly protected, such as by using a hardware security module or secure operating system based key storage.",,X,X,320,5.1.4.2 / 5.1.5.2
V2,Authentication,2.8.3,,"Verify that approved cryptographic algorithms are used in the generation, seeding, and verification.",,X,X,326,5.1.4.2 / 5.1.5.2
V2,Authentication,2.8.4,,Verify that time-based OTP can be used only once within the validity period.,,X,X,287,5.1.4.2 / 5.1.5.2
V2,Authentication,2.8.5,,"Verify that if a time-based multi factor OTP token is re-used during the validity period, it is logged and rejected with secure notifications being sent to the holder of the device.",,X,X,287,5.1.5.2
V2,Authentication,2.8.6,,"Verify physical single factor OTP generator can be revoked in case of theft or other loss. Ensure that revocation is immediately effective across logged in sessions, regardless of location.",,X,X,613,5.2.1
V2,Authentication,2.8.7,,Verify that biometric authenticators are limited to use only as secondary factors in conjunction with either something you have and something you know.,,o,X,308,5.2.3
V2,Authentication,2.9.1,,"Verify that cryptographic keys used in verification are stored securely and protected against disclosure, such as using a TPM or HSM, or an OS service that can use this secure storage.",,X,X,320,5.1.7.2
V2,Authentication,2.9.2,,"Verify that the challenge nonce is at least 64 bits in length, and statistically unique or unique over the lifetime of the cryptographic device.",,X,X,330,5.1.7.2
V2,Authentication,2.9.3,,"Verify that approved cryptographic algorithms are used in the generation, seeding, and verification.",,X,X,327,5.1.7.2
V3,Session,3.1.1,,Verify the application never reveals session tokens in URL parameters or error messages.,X,X,X,598,
V3,Session,3.2.1,,Verify the application generates a new session token on user authentication. ([C6](https://www.owasp.org/index.php/OWASP_Proactive_Controls#tab=Formal_Numbering)),X,X,X,384,7.1
V3,Session,3.2.2,,Verify that session tokens possess at least 64 bits of entropy. ([C6](https://www.owasp.org/index.php/OWASP_Proactive_Controls#tab=Formal_Numbering)),X,X,X,331,7.1
V3,Session,3.2.3,,Verify the application only stores session tokens in the browser using secure methods such as appropriately secured cookies (see section 3.4) or HTML 5 session storage.,X,X,X,539,7.1
V3,Session,3.2.4,,Verify that session token are generated using approved cryptographic algorithms. ([C6](https://www.owasp.org/index.php/OWASP_Proactive_Controls#tab=Formal_Numbering)),,X,X,331,7.1
V3,Session,3.3.1,,"Verify that logout and expiration invalidate the session token, such that the back button or a downstream relying party does not resume an authenticated session, including across relying parties. ([C6](https://www.owasp.org/index.php/OWASP_Proactive_Controls#tab=Formal_Numbering))",X,X,X,613,7.1
V3,Session,3.3.2,,"If authenticators permit users to remain logged in, verify that re-authentication occurs periodically both when actively used or after an idle period. ([C6](https://www.owasp.org/index.php/OWASP_Proactive_Controls#tab=Formal_Numbering))",30 days,"12 hours or 30 minutes of inactivity, 2FA optional","12 hours or 15 minutes of inactivity, with 2FA",613,7.2
V3,Session,3.3.3,,"Verify that the application terminates all other active sessions after a successful password change, and that this is effective across the application, federated login (if present), and any relying parties.",,X,X,613,
V3,Session,3.3.4,,Verify that users are able to view and log out of any or all currently active sessions and devices.,,X,X,613,7.1
V3,Session,3.4.1,,Verify that cookie-based session tokens have the 'Secure' attribute set. ([C6](https://www.owasp.org/index.php/OWASP_Proactive_Controls#tab=Formal_Numbering)),X,X,X,614,7.1.1
V3,Session,3.4.2,,Verify that cookie-based session tokens have the 'HttpOnly' attribute set. ([C6](https://www.owasp.org/index.php/OWASP_Proactive_Controls#tab=Formal_Numbering)),X,X,X,1004,7.1.1
V3,Session,3.4.3,,Verify that cookie-based session tokens utilize the 'SameSite' attribute to limit exposure to cross-site request forgery attacks. ([C6](https://www.owasp.org/index.php/OWASP_Proactive_Controls#tab=Formal_Numbering)),X,X,X,16,7.1.1
